{
  "email": "founder@example.com",
  "store_type": "Shopify",
  "monthly_revenue_range": "$50k-$100k",
  "calculator_inputs": {
    "starting_cash": 25000,
    "daily_ad_spend": 2500,
    "expected_roas": 2,
    "gross_margin_percent": 55,
    "payout_lag_days": 5,
    "inventory_supplier_payment": 10000,
    "inventory_payment_day": 5,
    "refund_adjustment_percent": 5
  },
  "consent": true
}
